id,type,question,options,answer,tag,explain,fullSentence,level
topic_71,fill,"Please make sure to ____ all the lights and the air conditioner before you leave the office.","extinguish|exit|examine|exchange",0,Office Procedures,"extinguish 這裡指熄滅燈火，常用於正式公告。","Please make sure to extinguish all the lights and the air conditioner before you leave the office.",intermediate
topic_72,job_define,"A person whose job is to repair and maintain electrical equipment and ""wiring"" in buildings.","electrician|mechanic|plumber|carpenter",0,Job Titles,"electrician 指的是「電工」。","An electrician is a person whose job is to repair and maintain electrical equipment and wiring in buildings.",beginner
topic_73,response_choice,"""I'm terribly sorry, I'm late for the project kickoff meeting.""","Don't worry, we've just started with the introductions.|Why are you late?|The meeting is in Room 302.|I am late too.",0,Social Interaction,"""Don't worry, we've just started..."" 是體諒對方遲到道歉的客氣回應。","I'm terribly sorry, I'm late for the project kickoff meeting. Don't worry, we've just started with the introductions.",beginner
topic_74,logic_grammar,"The information provided in the newly printed brochure is ____ accurate and up-to-date.","highly|high|height|higher",0,Grammar - Adverbs,"副詞 highly 修飾形容詞 accurate，意為「高度地（精確）」。","The information provided in the newly printed brochure is highly accurate and up-to-date.",intermediate
topic_75,fill,"The new software includes several features to ____ workflow and reduce administrative tasks.","streamline|straighten|strengthen|stress",0,Business Technology,"""streamline workflow"" 意為「簡化/優化工作流程」。","The new software includes several features to streamline workflow and reduce administrative tasks.",advanced
topic_76,job_define,"A person who works at the front desk of a hotel and handles ""check-ins"".","receptionist|concierge|porter|manager",0,Job Titles,"receptionist 指的是飯店「櫃檯人員」。","A receptionist is a person who works at the front desk of a hotel and handles check-ins.",beginner
topic_77,response_choice,"""Could you tell me the best way to get to the international airport from here?""","The easiest way is to take the airport express train.|The airport is very far away.|I'm going to the airport too.|Yes, I can tell you.",0,Travel Interaction,"提供具體、實用的交通方式是最好的回答。","Could you tell me the best way to get to the international airport from here? The easiest way is to take the airport express train.",beginner
topic_78,logic_grammar,"The training session will commence ____ 9:00 A.M. sharp in the main auditorium.","at|on|in|by",0,Grammar - Prepositions,"at 搭配確切的時間點。","The training session will commence at 9:00 A.M. sharp in the main auditorium.",beginner
topic_79,fill,"We are looking for someone with a ____ background in international trade and logistics.","strong|heavy|high|thick",0,Job Requirements,"""a strong background"" 意為「強大的背景/深厚的資歷」。","We are looking for someone with a strong background in international trade and logistics.",intermediate
topic_80,job_define,"A medical professional who takes care of people's teeth and ""gums"".","dentist|doctor|surgeon|nurse",0,Job Titles,"dentist 指的是「牙醫」。","A dentist is a medical professional who takes care of people's teeth and gums.",beginner
