id,type,question,options,answer,tag,explain,fullSentence,level
topic_1,fill,"The marketing director decided to ____ the launch of the new product, which was originally scheduled for this morning.","postpone|promote|distribute|cancel",0,Business Strategy,"postpone 意為「推遲」，常用於會議或計畫改期。","The marketing director decided to postpone the launch of the new product, which was originally scheduled for this morning.",intermediate
topic_2,job_define,"A professional who is responsible for ""inspecting"" a company's financial records to ensure they are accurate.","auditor|clerk|receptionist|stylist",0,Job Titles,"auditor 指的是「稽核員」或「審計師」。","An auditor is a professional who is responsible for ""inspecting"" a company's financial records to ensure they are accurate.",advanced
topic_3,response_choice,"""How about we grab a coffee after the conference finishes?""","I'd love to, but I have a flight to catch.|The coffee machine is broken.|I prefer tea over coffee.|Yes, the conference was long.",0,Social Interaction,"面對邀約，""I'd love to, but..."" 是委婉拒絕的經典禮貌回應。","How about we grab a coffee after the conference finishes? I'd love to, but I have a flight to catch.",intermediate
topic_4,logic_grammar,"Mr. Suzuki has been leading the research team ____ 2018, when the department was first established.","since|for|during|from",0,Grammar - Prepositions,"since 接特定的時間點，表示從過去某時持續至今。","Mr. Suzuki has been leading the research team since 2018, when the department was first established.",beginner
topic_5,fill,"Please ____ the receipt to your expense report, so the accounting team can process your reimbursement.","attach|attack|attain|attend",0,Office Procedures,"attach 意為「隨附」，常用於電子郵件附件或報帳單據。","Please attach the receipt to your expense report, so the accounting team can process your reimbursement.",intermediate
topic_6,job_define,"A person who helps passengers on an aircraft, ensures their safety, and serves ""refreshments"".","flight attendant|pilot|travel agent|navigator",0,Job Titles,"flight attendant 指的是「空服員」。","A flight attendant is a person who helps passengers on an aircraft and ensures their safety.",beginner
topic_7,response_choice,"""Would you mind helping me move these heavy boxes to the warehouse?""","Not at all, I'm happy to help.|Yes, I mind it very much.|The boxes are quite heavy.|I moved last week.",0,Social Interaction,"""Not at all"" 表示「一點也不介意」，通常用來爽快地答應請求。","Would you mind helping me move these heavy boxes to the warehouse? Not at all, I'm happy to help.",intermediate
topic_8,logic_grammar,"The new software is ____ more stable than the previous version, which had many bugs.","considerably|considerate|consideration|consider",0,Grammar - Adverbs,"considerably（相當地）副詞用來修飾比較級形容詞 more stable。","The new software is considerably more stable than the previous version, which had many bugs.",advanced
topic_9,fill,"The department head will ____ a presentation on the new budget plan, which includes several cost-cutting measures.","give|take|make|do",0,Business Meetings,"""give a presentation"" 是「進行簡報」的固定搭配。","The department head will give a presentation on the new budget plan, which includes several cost-cutting measures.",beginner
topic_10,job_define,"A person whose job is to arrange, design, and plan the layout of a ""building"".","architect|engineer|carpenter|decorator",0,Job Titles,"architect 指的是「建築師」。","An architect is a person whose job is to arrange, design, and plan the layout of a building.",intermediate
topic_11,response_choice,"""Could you tell me where the nearest post office is, please?""","It's just around the corner on Main Street.|I don't like sending mail.|The mail is delivered at 10 A.M.|Yes, I can tell you.",0,Daily Life,"回答位置時，""It's just around the corner""（就在轉角處）是常用說法。","Could you tell me where the nearest post office is, please? It's just around the corner on Main Street.",beginner
topic_12,logic_grammar,"If the shipment ____ not arrive by Friday, please notify the supplier immediately.","does|will|did|has",0,Grammar - Conditionals,"在 if 引導的條件句中，使用現在簡單式代替未來式。","If the shipment does not arrive by Friday, please notify the supplier immediately.",intermediate
topic_13,fill,"The company decided to ____ its headquarters to a more central location, such as downtown ""New York"".","relocate|release|relieve|rely",0,Corporate Moves,"relocate 意為「搬遷」，指公司或辦公室遷移地點。","The company decided to relocate its headquarters to a more central location, such as downtown New York.",intermediate
topic_14,job_define,"A person who prepares, seasons, and cooks food in a professional setting like a ""restaurant"".","chef|waiter|manager|cashier",0,Job Titles,"chef 指的是專業的「主廚」。","A chef is a person who prepares, seasons, and cooks food in a professional setting like a restaurant.",beginner
topic_15,response_choice,"""I'm sorry, but Mr. Lee is in a meeting at the moment and cannot take your call.""","No problem, I'll call back later.|Where is the meeting room?|Is he enjoying the meeting?|I am in a meeting too.",0,Office Communication,"當對方忙碌時，""I'll call back later""（我晚點再撥）是標準商業禮儀。","I'm sorry, but Mr. Lee is in a meeting at the moment and cannot take your call. No problem, I'll call back later.",beginner
topic_16,logic_grammar,"Neither the supervisor ____ the employees were satisfied with the final results of the project.","nor|or|and|but",0,Grammar - Conjunctions,"""neither... nor..."" 為固定搭配，意為「既不...也不...」。","Neither the supervisor nor the employees were satisfied with the final results of the project.",beginner
topic_17,fill,"We are ____ to announce the launch of our new eco-friendly product line, which uses 100% recycled materials.","proud|pride|proudly|priding",0,Business Marketing,"""be proud to"" 意為「很榮幸地/自豪地...」。","We are proud to announce the launch of our new eco-friendly product line, which uses 100% recycled materials.",beginner
topic_18,job_define,"A professional who provides legal advice, writes contracts, and represents people in ""court"".","lawyer|judge|officer|clerk",0,Job Titles,"lawyer 指的是「律師」。","A lawyer is a professional who provides legal advice, writes contracts, and represents people in court.",beginner
topic_19,response_choice,"""I've just passed my driving test on my very first try!""","Congratulations! That's great news.|Drive safely on the road.|Is it a difficult test?|I don't have a car yet.",0,Social Interaction,"對於別人的好消息，首選回應是 ""Congratulations!""（恭喜）。","I've just passed my driving test on my very first try! Congratulations! That's great news.",beginner
topic_20,logic_grammar,"The training session was so ____ that everyone stayed until the end to ask questions.","informative|information|informatively|inform",0,Grammar - Adjectives,"""so + 形容詞 + that""，informative 意為「內容充實的」。","The training session was so informative that everyone stayed until the end to ask questions.",intermediate
topic_21,fill,"Please ____ the terms of the agreement, as some points seem a bit ""confusing"".","clarify|classify|clash|classic",0,Legal Terms,"clarify 意為「澄清/闡明」，常用於釐清合約或語意。","Please clarify the terms of the agreement, as some points seem a bit confusing.",intermediate
topic_22,job_define,"A person who greets and deals with customers, especially in a hotel or ""office"".","receptionist|manager|janitor|guard",0,Job Titles,"receptionist 指的是「櫃檯接待人員」。","A receptionist is a person who greets and deals with customers, especially in a hotel or office.",beginner
topic_23,response_choice,"""Do you have this shirt in a medium size? I only see small and large here.""","Let me check the stockroom for you.|I prefer the blue one.|The medium size is too small.|Yes, we sell shirts here.",0,Shopping,"店員協助顧客尋找尺寸時，常用的回應是 ""Let me check the stockroom""。","Do you have this shirt in a medium size? I only see small and large here. Let me check the stockroom for you.",beginner
topic_24,logic_grammar,"Ms. Davis is the employee ____ performance has improved the most throughout the entire year.","whose|who|whom|which",0,Grammar - Pronouns,"whose 是所有格關係代名詞，用來修飾後方的名詞 performance。","Ms. Davis is the employee whose performance has improved the most throughout the entire year.",intermediate
topic_25,fill,"The maintenance crew will ____ the elevators early tomorrow morning, so please use the stairs.","service|serve|serving|servitude",0,Office Maintenance,"service 作為動詞時，意為「維修/保養（機器設備）」。","The maintenance crew will service the elevators early tomorrow morning, so please use the stairs.",intermediate
topic_26,job_define,"A person who takes photos as a profession, often using ""high-end"" cameras.","photographer|painter|editor|sculptor",0,Job Titles,"photographer 指的是「攝影師」。","A photographer is a person who takes photos as a profession, often using high-end cameras.",beginner
topic_27,response_choice,"""Is it okay if I leave an hour early today? I have a dentist appointment.""","As long as you finish your report.|What time is it now?|I left early yesterday.|You are late today.",0,Office Communication,"""As long as..."" 意為「只要...就可以」，常用於有條件地准許請求。","Is it okay if I leave an hour early today? I have a dentist appointment. As long as you finish your report.",intermediate
topic_28,logic_grammar,"The project must be finished ____ the end of the fiscal year, which is next Friday.","by|until|during|since",0,Grammar - Prepositions,"by 表示在某個時間截止點「之前」完成。","The project must be finished by the end of the fiscal year, which is next Friday.",beginner
topic_29,fill,"The CEO's speech was ____ received by the shareholders, who praised her vision.","well|good|better|best",0,Business News,"""well received"" 是固定搭配，表示「受到好評/被廣泛接受」。","The CEO's speech was well received by the shareholders, who praised her vision.",intermediate
topic_30,job_define,"A person whose job is to help customers in a shop, often referred to as a ""sales clerk"".","shop assistant|manager|cashier|buyer",0,Job Titles,"shop assistant 指的是「店員/門市人員」。","A shop assistant is a person whose job is to help customers in a shop, often referred to as a sales clerk.",beginner
topic_31,fill,"Please ____ that the parking lot will be under construction this weekend, so you may need to find alternative parking.","note|notice|notify|notion",0,Office Announcements,"""Please note that..."" 是「請注意...」的標準公告句型。","Please note that the parking lot will be under construction this weekend, so you may need to find alternative parking.",beginner
topic_32,job_define,"A person whose job is to keep or ""inspect"" financial accounts, ensuring all tax regulations are followed.","accountant|manager|receptionist|engineer",0,Job Titles,"accountant 指的是「會計師」。","An accountant is a person whose job is to keep or inspect financial accounts, ensuring all tax regulations are followed.",intermediate
topic_33,response_choice,"""I'm afraid I missed the deadline for the scholarship application. Is there anything I can do?""","You can still submit it if you pay a late fee.|The deadline was yesterday.|I don't like applications.|Why are you so late?",0,Administrative,"提供解決方案（如支付滯納金）是處理逾期申請時較具建設性的專業回應。","I'm afraid I missed the deadline for the scholarship application. You can still submit it if you pay a late fee.",intermediate
topic_34,logic_grammar,"The new marketing strategy has proved to be ____ more effective than the old one, resulting in higher sales.","significantly|significant|significance|signify",0,Grammar - Adverbs,"副詞 significantly 用來修飾比較級形容詞 more effective。","The new marketing strategy has proved to be significantly more effective than the old one, resulting in higher sales.",intermediate
topic_35,fill,"We are looking for a candidate who can ____ under pressure and meet tight deadlines.","work|walk|wake|wait",0,Job Requirements,"""work under pressure"" 意為「在壓力下工作」，是職缺描述中極為常見的片語。","We are looking for a candidate who can work under pressure and meet tight deadlines.",beginner
topic_36,job_define,"A person who is trained to help a doctor look after sick or ""injured"" people.","nurse|pharmacist|therapist|dentist",0,Job Titles,"nurse 指的是「護理師」。","A nurse is a person who is trained to help a doctor look after sick or injured people.",beginner
topic_37,response_choice,"""Could you give me a hand with this old photocopier? It seems to be jammed again.""","Sure, what seems to be the problem?|I don't like photos.|The copier is in the hallway.|Yes, I have two hands.",0,Office Interaction,"""Give someone a hand"" 是「幫某人忙」。回應時詢問問題所在展現出積極協助的意願。","Could you give me a hand with this old photocopier? Sure, what seems to be the problem?",beginner
topic_38,logic_grammar,"The CEO ____ to the staff when the fire alarm suddenly went off, causing everyone to evacuate.","was speaking|speaks|spoken|has spoken",0,Grammar - Verb Tense,"描述過去某個動作正在進行時（過去進行式），被另一個突發動作中斷。","The CEO was speaking to the staff when the fire alarm suddenly went off, causing everyone to evacuate.",intermediate
topic_39,fill,"The company offers a ____ range of benefits to its employees, including health insurance and gym memberships.","wide|high|long|deep",0,Business Benefits,"""a wide range of"" 意為「廣泛的/多樣的」，是描述選擇眾多時的固定搭配。","The company offers a wide range of benefits to its employees, including health insurance and gym memberships.",beginner
topic_40,job_define,"A person who designs or builds machines, engines, or ""electrical"" equipment.","engineer|architect|technician|mechanic",0,Job Titles,"engineer 指的是「工程師」。","An engineer is a person who designs or builds machines, engines, or electrical equipment.",beginner
topic_41,response_choice,"""Would you like to join us for lunch at that new Italian place? My treat!""","I'd love to, but I have a meeting at noon.|I already had breakfast.|Lunch is at 12:30.|Yes, I like food.",0,Social Interaction,"""I'd love to, but..."" 是委婉拒絕邀約最得體的句型。","Would you like to join us for lunch at that new Italian place? I'd love to, but I have a meeting at noon.",beginner
topic_42,logic_grammar,"Neither the project manager ____ the assistant knew where the sensitive files were stored.","nor|or|and|but",0,Grammar - Conjunctions,"""neither... nor..."" 意為「既不...也不...」。","Neither the project manager nor the assistant knew where the sensitive files were stored.",beginner
topic_43,fill,"Please ____ all travel expenses through the online portal within 30 days of your trip.","submit|subject|subsidize|substitute",0,Office Procedures,"submit expenses 意為「提交費用報支」。","Please submit all travel expenses through the online portal within 30 days of your trip.",intermediate
topic_44,job_define,"A person whose job is to arrange travel and holidays for people, often booking ""flights"" and hotels.","travel agent|tour guide|pilot|steward",0,Job Titles,"travel agent 指的是「旅行社人員/代辦」。","A travel agent is a person whose job is to arrange travel and holidays for people, often booking flights and hotels.",beginner
topic_45,response_choice,"""I'm sorry, your flight to London has been cancelled due to heavy fog.""","What are my options for the next available flight?|I don't like flying anyway.|The weather is nice today.|I want to go home now.",0,Travel Interaction,"詢問後續替代方案（options for the next available flight）是延誤時最正確的應對。","I'm sorry, your flight to London has been cancelled due to heavy fog. What are my options for the next available flight?",intermediate
topic_46,logic_grammar,"The seminar was ____ more interesting than I had expected, thanks to the engaging speaker.","much|very|so|too",0,Grammar - Modifiers,"much 可以用來修飾比較級形容詞，意為「...得多」。","The seminar was much more interesting than I had expected, thanks to the engaging speaker.",intermediate
topic_47,fill,"The newly developed app is designed to ____ user productivity by automating repetitive tasks.","boost|boast|boot|borrow",0,Business Strategy,"""boost productivity"" 意為「提升生產力」。","The newly developed app is designed to boost user productivity by automating repetitive tasks.",intermediate
topic_48,job_define,"A person whose job is to design buildings and supervise their construction to ensure ""safety"" standards.","architect|engineer|builder|carpenter",0,Job Titles,"architect 指的是「建築師」。","An architect is a person whose job is to design buildings and supervise their construction to ensure safety standards.",intermediate
topic_49,response_choice,"""Could you please send me the updated itinerary for the business trip to Tokyo?""","Certainly, I'll email it to you right away.|I'm going on vacation too.|The itinerary is very long.|Yes, I have it here.",0,Business Communication,"""Certainly... right away"" 是承諾立即執行他人請求的專業用語。","Could you please send me the updated itinerary for the business trip to Tokyo? Certainly, I'll email it to you right away.",beginner
topic_50,logic_grammar,"If I ____ you, I would double-check the figures in the report before the big presentation.","were|am|was|be",0,Grammar - Conditionals,"與現在事實相反的假設語氣，if 子句中 be 動詞不論人稱一律用 were。","If I were you, I would double-check the figures in the report before the big presentation.",intermediate
topic_51,fill,"Employees are encouraged to provide ____ on the new workplace policy to help us improve.","feedback|feed|fed|feedbacks",0,Office Communication,"provide feedback 意為「提供回饋」，注意 feedback 為不可數名詞。","Employees are encouraged to provide feedback on the new workplace policy to help us improve.",beginner
topic_52,job_define,"A person whose job is to sell medicines and give advice on how to use them ""safely"".","pharmacist|doctor|chemist|nurse",0,Job Titles,"pharmacist 指的是「藥劑師」。","A pharmacist is a person whose job is to sell medicines and give advice on how to use them safely.",intermediate
topic_53,response_choice,"""Excuse me, is this seat taken? I'd like to sit here if it's free.""","No, it's free. Help yourself.|Yes, I am sitting here.|The seat is very comfortable.|I prefer the window seat.",0,Daily Life,"""No, it's free. Help yourself."" 意為「沒人坐，請便」。","Excuse me, is this seat taken? No, it's free. Help yourself.",beginner
topic_54,logic_grammar,"The report, ____ was written by the marketing intern, contains several minor formatting errors.","which|who|whom|whose",0,Grammar - Relative Clauses,"which 指代前面的非限定名詞物（the report）。","The report, which was written by the marketing intern, contains several minor formatting errors.",intermediate
topic_55,fill,"We need to ____ a solution to this customer's complaint as soon as possible to maintain our reputation.","find|look|search|seek",0,Problem Solving,"""find a solution"" 意為「尋找/找到解決方案」。","We need to find a solution to this customer's complaint as soon as possible to maintain our reputation.",beginner
topic_56,job_define,"A person who translates ""spoken"" words from one language to another in real-time.","interpreter|translator|editor|writer",0,Job Titles,"interpreter 指的是「口譯員」，負責語音轉譯；translator 則多指文字筆譯。","An interpreter is a person who translates spoken words from one language to another in real-time.",intermediate
topic_57,response_choice,"""I'd like to make a reservation for a party of two for tonight at 7 P.M., please.""","What name should I put the reservation under?|We have a lot of tables.|I don't like Italian food.|The bill is 50 dollars.",0,Dining Out,"訂位時，服務生通常會詢問「訂位姓名」。","I'd like to make a reservation for a party of two for tonight at 7 P.M., please. What name should I put the reservation under?",beginner
topic_58,logic_grammar,"The training course is ____ for all new employees before they can access the company network.","mandatory|mandate|mandatorily|mandating",0,Grammar - Adjectives,"be mandatory for 意為「對...是強制的/義務的」。","The training course is mandatory for all new employees before they can access the company network.",intermediate
topic_59,fill,"The legal department is currently ____ the terms of the merger agreement very carefully.","reviewing|review|reviewed|reviews",0,Grammar - Verb Tense,"is currently 後接現在分詞 V-ing 構成現在進行式。","The legal department is currently reviewing the terms of the merger agreement very carefully.",beginner
topic_60,job_define,"A person who prepares and sells meat, often working in a small shop or a ""supermarket"".","butcher|baker|chef|grocer",0,Job Titles,"butcher 指的是「肉販/屠夫」。","A butcher is a person who prepares and sells meat, often working in a small shop or a supermarket.",beginner
topic_61,response_choice,"""How do you like your new position at the advertising firm?""","It's challenging but very rewarding.|I work from 9 to 5.|The office is in the city center.|I like my colleagues.",0,Social Interaction,"詢問對工作的看法時，回答整體的感受（如挑戰性與回饋感）最合適。","How do you like your new position at the advertising firm? It's challenging but very rewarding.",intermediate
topic_62,logic_grammar,"By the time the regional manager arrived, the meeting ____ already ended, much to his disappointment.","had|has|was|is",0,Grammar - Verb Tense,"過去完成式（had + P.P.）表示在過去某個時間點之前已經完成的動作。","By the time the regional manager arrived, the meeting had already ended, much to his disappointment.",advanced
topic_63,fill,"The marketing team achieved a ____ increase in online engagement after the new campaign launched.","notable|notably|noted|noting",0,Business Vocabulary,"notable increase 意為「顯著的/值得注意的增長」。","The marketing team achieved a notable increase in online engagement after the new campaign launched.",intermediate
topic_64,job_define,"A professional medical doctor who treats people who have skin problems or ""diseases"".","dermatologist|surgeon|physician|pediatrician",0,Job Titles,"dermatologist 指的是「皮膚科醫生」。","A dermatologist is a professional medical doctor who treats people who have skin problems or diseases.",advanced
topic_65,response_choice,"""Do you have any recommendations for a good local restaurant that isn't too expensive?""","There's a great Italian place just a few blocks away.|I don't eat out very often.|The food here is very expensive.|Yes, I recommend eating lunch.",0,Daily Life,"提供具體地點是回答推薦請求的最佳方式。","Do you have any recommendations for a good local restaurant that isn't too expensive? There's a great Italian place just a few blocks away.",beginner
topic_66,logic_grammar,"The production line will be shut down temporarily tomorrow morning ____ routine maintenance.","for|during|at|on",0,Grammar - Prepositions,"for maintenance 意為「為了維修（的目的）」。","The production line will be shut down temporarily tomorrow morning for routine maintenance.",beginner
topic_67,fill,"The company decided to ____ the launch of the new product due to unexpected technical issues.","postpone|promote|provide|proceed",0,Business Strategy,"postpone 意為「延後」。","The company decided to postpone the launch of the new product due to unexpected technical issues.",intermediate
topic_68,job_define,"A person whose job is to cut, style, and color people's hair in a ""salon"".","hairdresser|barber|stylist|tailor",0,Job Titles,"hairdresser 指的是「美髮師」。","A hairdresser is a person whose job is to cut, style, and color people's hair in a salon.",beginner
topic_69,response_choice,"""Is there anything else I can help you with today, Mr. Henderson?""","No, that's all for now. Thank you for your assistance.|Yes, I need more help.|I don't know what to do.|The weather is nice today.",0,Customer Service,"""No, that's all for now."" 是結束服務對話的禮貌語。","Is there anything else I can help you with today, Mr. Henderson? No, that's all for now. Thank you for your assistance.",beginner
topic_70,logic_grammar,"The more we practice our presentation skills, the ____ we will become at public speaking.","better|good|best|well",0,Grammar - Comparatives,"""The more..., the better..."" 意為「越...就越...」。","The more we practice our presentation skills, the better we will become at public speaking.",beginner
